<?xml version="1.0" encoding="ISO-8859-1"?>
<!DOCTYPE TEXT SYSTEM "file:./xml2html/data/xml/DOCUMENT.dtd">

<TEXT>

<SUBSECTION TITLE="The API">

<P>
Mad-MPI implements almost all of the functionalities of the MPI
standard. Some additional functionalities have been added to provide
users with the facilities of the underlying NewMadeleine communication
engine. The complete API is available at the following URL:
  <LATEX>\begin{quote}</LATEX>
  <URL>http://pm2.gforge.inria.fr/newmadeleine/html/group__mpi__interface.html</URL>
  <LATEX>\end{quote}</LATEX>
</P>

</SUBSECTION>

<SUBSECTION TITLE="Debugging Mad-MPI applications">
<UL>
<LI>
<P>
If you wish to start your application under the debugger, you can use
the option <TT>-d</TT>. All the processes of the MPI application
will be launched through <TT>gdb</TT>, the GNU debugger.
</P>
<CODE FILE="./code/executeWithGdb.txt"/>
</LI>

<LI>
<P>
If you wish to start your application under valgrind, you can use
the option <TT>-valgrind</TT>.
</P>
<CODE FILE="./code/executeWithValgrind.txt"/>
</LI>
</UL>

</SUBSECTION>


</TEXT>

