<?xml version="1.0" encoding="ISO-8859-1"?>
<!DOCTYPE TEXT SYSTEM "file:../xml2html/data/xml/DOCUMENT.dtd">

<TEXT>

<SUBSECTION TITLE="Mastering Marcel">

<P>
Marcel has some functionalities which are disabled by default: 

<UL>
<LI> The support of the <TT>atexit</TT> function,</LI>
<LI> The support of blocking system calls,</LI>
<LI> The support of the cleanup functions,</LI>
<LI> The support of marcel exceptions,</LI>
<LI> The support of the keys/thread-specific data handling mechanisms,</LI>
<LI> The support of the <TT>once</TT> function,</LI>
<LI> The support of the <TT>postexit</TT> function,</LI>
<LI> The support of the signals mechanism,</LI>
<LI> The support of the <TT>suspend</TT> function,</LI>
<LI> The support of the userspace mechanism.</LI>
</UL>

To enable them, you need to change your PM2 flavor by adding the options
<TT>enable_atexit</TT>,
<TT>enable_blocking</TT>,
<TT>enable_cleanup</TT>,
<TT>enable_exceptions</TT>,
<TT>enable_keys</TT>,
<TT>enable_once</TT>,
<TT>enable_postexit</TT>,
<TT>enable_signals</TT>,
<TT>enable_suspend</TT>,
or <TT>enable_userspace</TT>.
</P>

<P>
Marcel can be made to use part of the machine's processors: adding
<TT>--marcel-nvp 4</TT> to the command line will make it use only 4 processors.
By default, Marcel tries to <I>spread</I> over the machine, i.e. when using 4
processors of a quad-quad core machine, it will use one core of each of the 4
dies. To use <I>adjacent</I> processors, append <TT>--marcel-cpustride 1</TT>
to the command line. Eventually, appending the <TT>--marcel-firstcpu 4</TT>
option makes Marcel use processors from the fifth processor. For instance, on a
quad-quad core machine, one could run 4 Marcel applications this way:

<UL>
<LI>appli1 --marcel-nvp 4 --marcel-cpustride 1 --marcel-firstcpu 0
<LI>appli2 --marcel-nvp 4 --marcel-cpustride 1 --marcel-firstcpu 4
<LI>appli3 --marcel-nvp 4 --marcel-cpustride 1 --marcel-firstcpu 8
<LI>appli4 --marcel-nvp 4 --marcel-cpustride 1 --marcel-firstcpu 12
</UL>

Each application will get bound to a die.
</P>

<P>
Other Marcel options are available, append <TT>--marcel-help</TT> to the command line to get some help.
</P>

</SUBSECTION>

</TEXT>
