<?xml version="1.0" encoding="ISO-8859-1"?>
<!DOCTYPE DOCUMENT SYSTEM "file:../xml2html/data/xml/DOCUMENT.dtd">
<DOCUMENT TITLE="Getting started with PM2"
          AUTHOR="The PM2 Team" EMAIL="runtime@labri.fr">
<!-- AUTHOR="Olivier Aumage and Gabriel Antoniu and Luc Bougé and Vincent Danjean and Raymond Namyst" EMAIL="runtime@labri.fr" -->

<!-- DATE="December 2005" -->

<WML INCLUDE="my_macros.txt"/>

<LABRI/> <!-- NUMBER="RR-1375-05" -->

<ABSTRACT TABLEOFPROGRAMS="true">
<P>
PM2 (<EM>Parallel Multithreaded Machine</EM>) is a distributed
multithreaded programming environment designed to efficiently support
irregular parallel applications on distributed architectures of SMP
nodes. This manual presents an installer's, user's and developer's guide for
 PM2.
</P>
<P>
If you have any questions concerning PM2, please, send an email to
 <EMAIL>pm2-users@lists.gforge.inria.fr</EMAIL>. However, please first
 make sure that your problem is not already listed in the
 <EM>Frequently Asked   Questions</EM> Section <REF LABEL="sec:faq"/>.
</P>
<P>
  The latest version of this document is available from the following
  URL:
  <LATEX>\begin{quote}</LATEX>
  <URL>http://runtime.futurs.inria.fr/pm2-doc/</URL>
  <LATEX>\end{quote}</LATEX>
</P>
<KEYWORD>RPC, Communication, Thread, Distributed Programming.</KEYWORD>
</ABSTRACT>

<INRIA TYPE="RT" TITRE="Démarrer avec PM2">
<RESUME>
<MOTCLE></MOTCLE>
</RESUME>
</INRIA>

<SECTION TITLE="Introducing PM2" FILE="./Sources/introduction.xml" LABEL="introduction" NEWPAGE="true"/>

<SECTION TITLE="Installing PM2" FILE="./Sources/installation.xml" LABEL="installation" NEWPAGE="true"/>

<SECTION TITLE="Discovering PM2" FILE="./Sources/discovering.xml" LABEL="discovering" NEWPAGE="true"/>

<SECTION TITLE="Customizing and debugging PM2" FILE="./Sources/customizing.xml" LABEL="customizing" NEWPAGE="true"/>

<SECTION TITLE="Mastering PM2" FILE="./Sources/mastering.xml" LABEL="mastering" NEWPAGE="true"/>

<SECTION TITLE="Wizarding PM2: advanced features" FILE="./Sources/wizarding.xml" LABEL="wizarding" NEWPAGE="true"/>

<SECTION TITLE="Additional PM2 material" FILE="./Sources/appendicing.xml" LABEL="appendicing" NEWPAGE="true"/>

<SECTION TITLE="Reading on PM2" FILE="./Sources/reading.xml" LABEL="reading" NEWPAGE="true"/>


</DOCUMENT>

